{
  "$schema": "https://blimy.dev/schemas/extension.json",
  "id": "blimy.skill.code-review",
  "name": "code-review",
  "displayName": "Code Review",
  "description": "Review code changes for correctness, regressions, and missing validation.",
  "version": "1.0.0",
  "publisher": "Blimy",
  "categories": ["Skill"],
  "contributes": {
    "skills": [
      {
        "id": "blimy.code-review",
        "name": "Code Review",
        "description": "Review code changes for correctness, regressions, and missing validation.",
        "path": "SKILL.md",
        "tags": ["review", "quality"]
      }
    ]
  },
  "icon": "icon.svg",
  "license": "MIT",
  "repository": {
    "type": "git",
    "url": "https://github.com/blimydev/blimy"
  }
}
