{
  "$schema": "https://blimy.dev/schemas/extension.json",
  "id": "blimy.javascript",
  "name": "JavaScript",
  "displayName": "JavaScript",
  "version": "1.0.0",
  "description": "JavaScript language support with LSP and tooling",
  "publisher": "Blimy",
  "categories": ["Language"],
  "languages": [
    {
      "id": "javascript",
      "extensions": [".js", ".mjs", ".cjs", ".jsx"],
      "aliases": ["JavaScript", "js"]
    }
  ],
  "capabilities": {
    "lsp": {
      "name": "typescript-language-server",
      "runtime": "bun",
      "package": "typescript-language-server",
      "packages": ["typescript"],
      "args": ["--stdio"]
    },
    "formatter": {
      "name": "prettier",
      "runtime": "bun",
      "package": "prettier",
      "args": ["--stdin-filepath", "${file}"]
    },
    "linter": {
      "name": "eslint",
      "runtime": "bun",
      "package": "eslint",
      "args": ["--stdin", "--stdin-filename", "${file}", "--format", "json"]
    }
  }
}
