{
  "$schema": "https://blimy.dev/schemas/extension.json",
  "id": "blimy.database.duckdb",
  "name": "DuckDB",
  "displayName": "DuckDB Provider",
  "version": "1.0.0",
  "description": "DuckDB database browser and query provider.",
  "publisher": "Blimy",
  "categories": ["Database"],
  "activationEvents": ["onDatabase:duckdb"],
  "license": "MIT",
  "repository": {
    "type": "git",
    "url": "https://github.com/blimydev/blimy/tree/master/extensions/official/duckdb"
  },
  "icon": "icon.svg",
  "databases": [
    {
      "id": "duckdb",
      "label": "DuckDB",
      "isFileBased": true,
      "protocolVersion": 1,
      "fileExtensions": [".duckdb", ".duck"],
      "sidecar": {
        "darwin-arm64": "bin/blimy-db-duckdb",
        "darwin-x64": "bin/blimy-db-duckdb",
        "linux-arm64": "bin/blimy-db-duckdb",
        "linux-x64": "bin/blimy-db-duckdb",
        "win32-x64": "bin/blimy-db-duckdb.exe"
      }
    }
  ]
}
