{
  "$schema": "https://blimy.dev/schemas/extension.json",
  "id": "blimy.database.redis",
  "name": "Redis",
  "displayName": "Redis Provider",
  "version": "1.0.0",
  "description": "Redis connection, key scanning, and value editing provider.",
  "publisher": "Blimy",
  "categories": ["Database"],
  "activationEvents": ["onDatabase:redis"],
  "license": "MIT",
  "repository": {
    "type": "git",
    "url": "https://github.com/blimydev/blimy/tree/master/extensions/official/redis"
  },
  "icon": "icon.svg",
  "databases": [
    {
      "id": "redis",
      "label": "Redis",
      "isFileBased": false,
      "protocolVersion": 1,
      "defaultPort": 6379,
      "sidecar": {
        "darwin-arm64": "bin/blimy-db-redis",
        "darwin-x64": "bin/blimy-db-redis",
        "linux-arm64": "bin/blimy-db-redis",
        "linux-x64": "bin/blimy-db-redis",
        "win32-x64": "bin/blimy-db-redis.exe"
      }
    }
  ]
}
