{
  "$schema": "https://blimy.dev/schemas/extension.json",
  "id": "blimy.protobuf",
  "name": "Protobuf",
  "displayName": "Protocol Buffers",
  "version": "1.0.0",
  "description": "Protocol Buffers language support with syntax highlighting",
  "publisher": "Blimy",
  "categories": ["Language"],
  "languages": [
    {
      "id": "protobuf",
      "extensions": [".proto"],
      "aliases": ["Protocol Buffers", "Protobuf", "proto"]
    }
  ]
}
