{
  "$schema": "https://blimy.dev/schemas/extension.json",
  "id": "blimy.tsx",
  "name": "TSX",
  "displayName": "TypeScript JSX",
  "version": "1.0.0",
  "description": "TypeScript JSX/React support with LSP and tooling",
  "publisher": "Blimy",
  "categories": ["Language"],
  "languages": [
    {
      "id": "typescriptreact",
      "extensions": [".tsx"],
      "aliases": ["TSX", "TypeScript React"]
    }
  ],
  "capabilities": {
    "lsp": {
      "name": "typescript-language-server",
      "runtime": "bun",
      "package": "typescript-language-server",
      "packages": ["typescript"],
      "args": ["--stdio"]
    },
    "formatter": {
      "name": "prettier",
      "runtime": "bun",
      "package": "prettier",
      "args": ["--stdin-filepath", "${file}"]
    },
    "linter": {
      "name": "eslint",
      "runtime": "bun",
      "package": "eslint",
      "args": ["--stdin", "--stdin-filename", "${file}", "--format", "json"]
    }
  }
}
