{
  "$schema": "https://blimy.dev/schemas/extension.json",
  "id": "blimy.elisp",
  "name": "EmacsLisp",
  "displayName": "Emacs Lisp",
  "version": "1.0.0",
  "description": "Emacs Lisp language support",
  "publisher": "Blimy",
  "categories": ["Language"],
  "languages": [
    {
      "id": "elisp",
      "extensions": [".el", ".emacs"],
      "aliases": ["Emacs Lisp", "elisp"]
    }
  ]
}
