{
  "$schema": "https://blimy.dev/schemas/extension.json",
  "id": "blimy.agent.claude-acp",
  "name": "Claude Agent",
  "displayName": "Claude Agent",
  "description": "Claude's coding agent, connected through the ACP adapter powered by Anthropic's Claude Agent SDK.",
  "version": "1.0.0",
  "publisher": "Agent Client Protocol",
  "categories": ["Agent"],
  "agents": [
    {
      "id": "claude-acp",
      "name": "Claude Agent",
      "binaryName": "claude-agent-acp",
      "description": "Claude's coding agent, connected through the ACP adapter powered by Anthropic's Claude Agent SDK.",
      "args": [],
      "install": {
        "runtime": "node",
        "package": "@agentclientprotocol/claude-agent-acp@0.73.0",
        "version": "0.73.0",
        "command": "claude-agent-acp"
      }
    }
  ]
}
