{
  "$schema": "https://blimy.dev/schemas/extension.json",
  "id": "blimy.sentry",
  "name": "sentry",
  "displayName": "Sentry",
  "description": "Inspect unresolved Sentry issues for a project without leaving Blimy.",
  "version": "1.0.0",
  "publisher": "Blimy",
  "categories": ["Integration"],
  "integrations": [
    {
      "id": "sentry",
      "name": "Sentry",
      "description": "Sentry errors and issue activity",
      "kind": "observability",
      "icon": "sentry"
    }
  ],
  "main": "main.js",
  "permissions": {
    "network": ["https://*", "http://localhost:*", "http://127.0.0.1:*"],
    "secrets": true,
    "openExternal": true,
    "clipboardWrite": true
  },
  "icon": "icon.svg",
  "license": "MIT",
  "repository": {
    "type": "git",
    "url": "https://github.com/blimydev/blimy"
  }
}
